{
  "$schema": "https://json-schema.org/draft/2020-12/schema",
  "title": "Fideon canonical schema - dwelling_fire (policy_check)",
  "description": "SPEC_21 section 4 canonical schema for dwelling_fire (code DF), composing common_model.json 1.0.0 by $ref: the envelope plus locations and buildings. Built from all 16 dwelling fire seed golds of 4 carriers and the line's registry YAMLs. No LOB block.",
  "fideon:doc_type": "policy_check",
  "fideon:lob": "dwelling_fire",
  "fideon:lob_code": "DF",
  "fideon:layout_family": "personal_lines",
  "fideon:schema_version": "1.0.0",
  "fideon:common_model_version": "1.0.0",
  "fideon:status": "SPEC_21 Phase 2 schema, built from 16 seed golds of 4 carriers; field list awaiting project-owner approval",
  "fideon:built_from": {
    "seed_golds": 16,
    "carriers": [
      "Dryden Mutual",
      "Leatherstocking Cooperative Insurance Company",
      "NYCM Insurance",
      "North Country Insurance Company"
    ],
    "registry_yamls": [
      "dwelling_fire"
    ]
  },
  "fideon:blocks_used": [
    "locations",
    "buildings"
  ],
  "fideon:lob_block": "None. Every concept the seeds print has a home in the envelope or a common-model building block (SPEC_21 4.2.4).",
  "fideon:coverage_codes_file": "dwelling_fire.coverage_codes.yaml",
  "fideon:coverage_codes": [
    "DF_COV_A",
    "DF_COV_B",
    "DF_COV_C",
    "DF_COV_L",
    "DF_EC_LOSS_OF_USE",
    "DF_EC_OTHER_STRUCTURES",
    "DF_EC_PERSONAL_PROPERTY",
    "DF_EC_RESIDENCE",
    "DF_INCIDENTAL_BUSINESS",
    "DF_TENANT_VANDALISM",
    "DF_VMM_LOSS_OF_USE",
    "DF_VMM_OTHER_STRUCTURES",
    "DF_VMM_PERSONAL_PROPERTY",
    "DF_VMM_RESIDENCE",
    "X_LOSS_OF_USE",
    "X_MED_PAY",
    "X_WATER_BACKUP"
  ],
  "fideon:mandatory_fields": [
    "carrier.name",
    "named_insured.primary_name",
    "policy.policy_number",
    "policy.effective_date",
    "policy.expiration_date",
    "coverages[].limits[].amount"
  ],
  "fideon:audit_rules": [
    "policy.effective_date < policy.expiration_date",
    "months_between(policy.effective_date, policy.expiration_date) == policy.term_months",
    "policy.effective_date <= document.transaction_effective_date <= policy.expiration_date",
    "len(coverages[].limits[]) >= 1",
    "`coverages[coverage_code=DF_COV_C].limits[limit_type=per_occurrence].amount` <= `coverages[coverage_code=DF_COV_A].limits[limit_type=per_occurrence].amount`",
    "premium.total == sum(coverages[].premium) + sum(forms_and_endorsements[].premium) + sum(premium.items[].amount) + sum(premium.surcharges[].amount) + sum(premium.taxes_fees[].amount) ± 0.01"
  ],
  "fideon:audit_rules_note": "Rules 1-4 are common_model.json fideon:default_audit_rules (the claims-made rule left out); NYCM prints the term. The premium rule holds on every seed whose printed amounts add up; a rule whose values a document does not print is not evaluated.",
  "fideon:aliases": {
    "buildings[].construction": [
      "Construction",
      "Construction Type"
    ],
    "buildings[].number_of_units": [
      "# of Units"
    ],
    "buildings[].occupancy": [
      "Occupancy",
      "Risk Description"
    ],
    "buildings[].roof_type": [
      "Roof Type"
    ],
    "buildings[].year_built": [
      "Year Built",
      "Year of Construction"
    ],
    "carrier.name": [
      "Insurance Provided By"
    ],
    "coverages[].deductibles[].amount": [
      "Deductible"
    ],
    "coverages[].valuation": [
      "Loss Settlement",
      "Loss Settlement Building",
      "Loss Settlement Contents"
    ],
    "deductibles[].amount": [
      "Deductible"
    ],
    "document.endorsement_number": [
      "Term-Seq"
    ],
    "document.transaction_date": [
      "Process Date"
    ],
    "document.transaction_effective_date": [
      "Effective Date of Change",
      "Amended Declarations Page as of"
    ],
    "document.transaction_reason": [
      "Transaction Reason Description"
    ],
    "interested_parties[].is_payor": [
      "Payor"
    ],
    "interested_parties[].name": [
      "1st Mortgagee"
    ],
    "locations[].address.county": [
      "County",
      "County Name"
    ],
    "locations[].distance_to_fire_station": [
      "Miles From Fire Dept"
    ],
    "locations[].distance_to_hydrant": [
      "Feet From Hydrant"
    ],
    "locations[].fire_district": [
      "Fire District"
    ],
    "locations[].protection_class": [
      "Protection Class",
      "Fire Protection"
    ],
    "locations[].territory": [
      "Territory"
    ],
    "named_insured.date_of_birth": [
      "DOB"
    ],
    "named_insured.primary_name": [
      "Named Insured",
      "Named Insured & Mailing Address",
      "Named Insured and Address",
      "Named Insured and Mailing Address"
    ],
    "policy.effective_date": [
      "Effective Date",
      "Policy Term Effective Date",
      "Inception Date"
    ],
    "policy.expiration_date": [
      "Expiration Date"
    ],
    "policy.original_inception_date": [
      "Protected Since Date"
    ],
    "policy.policy_number": [
      "Policy Number",
      "Policy #",
      "Policy ID"
    ],
    "policy.term_months": [
      "Term Length"
    ],
    "premium.change": [
      "Premium adjustment for this change"
    ],
    "premium.total": [
      "Total Annual Policy Premium",
      "Total Policy Premium",
      "Total Quoted Premium",
      "TOTAL PREMIUM"
    ],
    "producer.email": [
      "Email Address"
    ],
    "producer.fax": [
      "Fax"
    ],
    "producer.phone": [
      "Phone Number"
    ]
  },
  "type": "object",
  "additionalProperties": false,
  "required": [
    "document",
    "carrier",
    "named_insured",
    "policy",
    "lob_parts",
    "coverages"
  ],
  "properties": {
    "document": {
      "$ref": "../common/common_model.json#/$defs/document"
    },
    "carrier": {
      "$ref": "../common/common_model.json#/$defs/carrier"
    },
    "producer": {
      "$ref": "../common/common_model.json#/$defs/producer"
    },
    "named_insured": {
      "$ref": "../common/common_model.json#/$defs/named_insured"
    },
    "policy": {
      "$ref": "../common/common_model.json#/$defs/policy"
    },
    "lob_parts": {
      "$ref": "../common/common_model.json#/$defs/lob_parts"
    },
    "coverages": {
      "$ref": "../common/common_model.json#/$defs/coverages"
    },
    "deductibles": {
      "$ref": "../common/common_model.json#/$defs/deductibles"
    },
    "interested_parties": {
      "$ref": "../common/common_model.json#/$defs/interested_parties"
    },
    "premium": {
      "$ref": "../common/common_model.json#/$defs/premium"
    },
    "billing": {
      "$ref": "../common/common_model.json#/$defs/billing"
    },
    "forms_and_endorsements": {
      "$ref": "../common/common_model.json#/$defs/forms_and_endorsements"
    },
    "locations": {
      "$ref": "../common/common_model.json#/$defs/locations"
    },
    "buildings": {
      "$ref": "../common/common_model.json#/$defs/buildings"
    },
    "additional_fields": {
      "$ref": "../common/common_model.json#/$defs/additional_fields"
    },
    "text_sections": {
      "$ref": "../common/common_model.json#/$defs/text_sections"
    },
    "fideon:provenance": {
      "$ref": "../common/common_model.json#/$defs/provenance"
    }
  }
}
