{
  "document": {
    "doc_type": "policy_check",
    "modality": "native_pdf",
    "transaction_type": {
      "raw": "RENEWAL",
      "parsed": "renewal",
      "confidence": {
        "score": 1.0,
        "source": "deterministic"
      },
      "page_ref": [
        1
      ],
      "flagged": false
    },
    "title": {
      "raw": "Homeowners Policy Declarations",
      "parsed": "Homeowners Policy Declarations",
      "confidence": {
        "score": 1.0,
        "source": "deterministic"
      },
      "page_ref": [
        1
      ],
      "flagged": false
    },
    "issue_date": {
      "raw": "09/14/2026",
      "parsed": "09/14/2026",
      "confidence": {
        "score": 1.0,
        "source": "deterministic"
      },
      "page_ref": [
        1
      ],
      "flagged": false
    },
    "print_date": {
      "raw": "09/15/2026",
      "parsed": "09/15/2026",
      "confidence": {
        "score": 1.0,
        "source": "deterministic"
      },
      "page_ref": [
        1
      ],
      "flagged": false
    },
    "page_count": 3,
    "source_file_name": "example_home_dec.pdf"
  },
  "carrier": {
    "name": {
      "raw": "Example Mutual Insurance Company",
      "parsed": "Example Mutual Insurance Company",
      "confidence": {
        "score": 1.0,
        "source": "deterministic"
      },
      "page_ref": [
        1
      ],
      "flagged": false
    },
    "naic_code": {
      "raw": "00000",
      "parsed": "00000",
      "confidence": {
        "score": 1.0,
        "source": "deterministic"
      },
      "page_ref": [
        1
      ],
      "flagged": false
    },
    "address": {
      "street": {
        "raw": "1 Example Plaza",
        "parsed": "1 Example Plaza",
        "confidence": {
          "score": 1.0,
          "source": "deterministic"
        },
        "page_ref": [
          1
        ],
        "flagged": false
      },
      "city": {
        "raw": "Albany",
        "parsed": "Albany",
        "confidence": {
          "score": 1.0,
          "source": "deterministic"
        },
        "page_ref": [
          1
        ],
        "flagged": false
      },
      "state": {
        "raw": "NY",
        "parsed": "NY",
        "confidence": {
          "score": 1.0,
          "source": "deterministic"
        },
        "page_ref": [
          1
        ],
        "flagged": false
      },
      "postal_code": {
        "raw": "12207",
        "parsed": "12207",
        "confidence": {
          "score": 1.0,
          "source": "deterministic"
        },
        "page_ref": [
          1
        ],
        "flagged": false
      }
    },
    "phone": {
      "raw": "(800) 555-0100",
      "parsed": "(800) 555-0100",
      "confidence": {
        "score": 1.0,
        "source": "deterministic"
      },
      "page_ref": [
        1
      ],
      "flagged": false
    },
    "claims_phone": {
      "raw": "(800) 555-0199",
      "parsed": "(800) 555-0199",
      "confidence": {
        "score": 1.0,
        "source": "deterministic"
      },
      "page_ref": [
        1
      ],
      "flagged": false
    },
    "admitted_status": {
      "raw": "Admitted",
      "parsed": "admitted",
      "confidence": {
        "score": 1.0,
        "source": "deterministic"
      },
      "page_ref": [
        1
      ],
      "flagged": false
    }
  },
  "producer": {
    "agency_name": {
      "raw": "Sample Agency LLC",
      "parsed": "Sample Agency LLC",
      "confidence": {
        "score": 1.0,
        "source": "deterministic"
      },
      "page_ref": [
        1
      ],
      "flagged": false
    },
    "producer_code": {
      "raw": "A-0001",
      "parsed": "A-0001",
      "confidence": {
        "score": 1.0,
        "source": "deterministic"
      },
      "page_ref": [
        1
      ],
      "flagged": false
    },
    "phone": {
      "raw": "(518) 555-0142",
      "parsed": "(518) 555-0142",
      "confidence": {
        "score": 1.0,
        "source": "deterministic"
      },
      "page_ref": [
        1
      ],
      "flagged": false
    }
  },
  "named_insured": {
    "primary_name": {
      "raw": "TAYLOR SAMPLE",
      "parsed": "TAYLOR SAMPLE",
      "confidence": {
        "score": 1.0,
        "source": "deterministic"
      },
      "page_ref": [
        1
      ],
      "flagged": false
    },
    "mailing_address": {
      "street": {
        "raw": "12 Elm St",
        "parsed": "12 Elm St",
        "confidence": {
          "score": 1.0,
          "source": "deterministic"
        },
        "page_ref": [
          1
        ],
        "flagged": false
      },
      "city": {
        "raw": "Troy",
        "parsed": "Troy",
        "confidence": {
          "score": 1.0,
          "source": "deterministic"
        },
        "page_ref": [
          1
        ],
        "flagged": false
      },
      "state": {
        "raw": "NY",
        "parsed": "NY",
        "confidence": {
          "score": 1.0,
          "source": "deterministic"
        },
        "page_ref": [
          1
        ],
        "flagged": false
      },
      "postal_code": {
        "raw": "12180",
        "parsed": "12180",
        "confidence": {
          "score": 1.0,
          "source": "deterministic"
        },
        "page_ref": [
          1
        ],
        "flagged": false
      },
      "county": {
        "raw": "Rensselaer",
        "parsed": "Rensselaer",
        "confidence": {
          "score": 1.0,
          "source": "deterministic"
        },
        "page_ref": [
          1
        ],
        "flagged": false
      }
    }
  },
  "policy": {
    "policy_number": {
      "raw": "HX-0000-0001",
      "parsed": "HX-0000-0001",
      "confidence": {
        "score": 1.0,
        "source": "deterministic"
      },
      "page_ref": [
        1
      ],
      "flagged": false
    },
    "prior_policy_number": {
      "raw": "HX-0000-0000",
      "parsed": "HX-0000-0000",
      "confidence": {
        "score": 1.0,
        "source": "deterministic"
      },
      "page_ref": [
        1
      ],
      "flagged": false
    },
    "effective_date": {
      "raw": "10/01/2026",
      "parsed": "10/01/2026",
      "confidence": {
        "score": 1.0,
        "source": "deterministic"
      },
      "page_ref": [
        1
      ],
      "flagged": false
    },
    "expiration_date": {
      "raw": "10/01/2027",
      "parsed": "10/01/2027",
      "confidence": {
        "score": 1.0,
        "source": "deterministic"
      },
      "page_ref": [
        1
      ],
      "flagged": false
    },
    "term_months": {
      "raw": "12 Months",
      "parsed": 12,
      "confidence": {
        "score": 1.0,
        "source": "deterministic"
      },
      "page_ref": [
        1
      ],
      "flagged": false
    },
    "coverage_trigger": {
      "raw": "Occurrence",
      "parsed": "occurrence",
      "confidence": {
        "score": 1.0,
        "source": "deterministic"
      },
      "page_ref": [
        1
      ],
      "flagged": false
    },
    "rating_state": {
      "raw": "NY",
      "parsed": "NY",
      "confidence": {
        "score": 1.0,
        "source": "deterministic"
      },
      "page_ref": [
        1
      ],
      "flagged": false
    }
  },
  "lob_parts": [
    {
      "part_id": "part_1",
      "lob": "homeowners",
      "title": {
        "raw": "Homeowners Policy",
        "parsed": "Homeowners Policy",
        "confidence": {
          "score": 1.0,
          "source": "deterministic"
        },
        "page_ref": [
          1
        ],
        "flagged": false
      }
    }
  ],
  "locations": [
    {
      "unit_id": "loc_1",
      "location_number": {
        "raw": "1",
        "parsed": 1,
        "confidence": {
          "score": 1.0,
          "source": "deterministic"
        },
        "page_ref": [
          1
        ],
        "flagged": false
      },
      "address": {
        "street": {
          "raw": "12 Elm St",
          "parsed": "12 Elm St",
          "confidence": {
            "score": 1.0,
            "source": "deterministic"
          },
          "page_ref": [
            1
          ],
          "flagged": false
        },
        "city": {
          "raw": "Troy",
          "parsed": "Troy",
          "confidence": {
            "score": 1.0,
            "source": "deterministic"
          },
          "page_ref": [
            1
          ],
          "flagged": false
        },
        "state": {
          "raw": "NY",
          "parsed": "NY",
          "confidence": {
            "score": 1.0,
            "source": "deterministic"
          },
          "page_ref": [
            1
          ],
          "flagged": false
        },
        "postal_code": {
          "raw": "12180",
          "parsed": "12180",
          "confidence": {
            "score": 1.0,
            "source": "deterministic"
          },
          "page_ref": [
            1
          ],
          "flagged": false
        },
        "county": {
          "raw": "Rensselaer",
          "parsed": "Rensselaer",
          "confidence": {
            "score": 1.0,
            "source": "deterministic"
          },
          "page_ref": [
            1
          ],
          "flagged": false
        }
      },
      "protection_class": {
        "raw": "3",
        "parsed": "3",
        "confidence": {
          "score": 1.0,
          "source": "deterministic"
        },
        "page_ref": [
          1
        ],
        "flagged": false
      },
      "fire_district": {
        "raw": "Troy FD",
        "parsed": "Troy FD",
        "confidence": {
          "score": 1.0,
          "source": "deterministic"
        },
        "page_ref": [
          1
        ],
        "flagged": false
      }
    }
  ],
  "buildings": [
    {
      "unit_id": "bldg_1",
      "location_ref": "loc_1",
      "construction": {
        "raw": "Frame",
        "parsed": "Frame",
        "confidence": {